id,dialogue,summary
76b8cf7a,"Ben: It's almost Sarah's 30th! We should totally throw her a surprise party.
Lisa: OMG YES! That's a great idea. When should we do it?
Ben: The weekend before her actual birthday? That way she won't suspect.
Lisa: Perfect. I can handle decorations if you want to sort out the food?","Ben and Lisa are planning a surprise 30th birthday party for Sarah. They plan to hold it the weekend before her birthday, with Ben handling food and Lisa handling decorations."
af479531,"Mia: Okay, bio exam is looming. Who wants to cram together?
Leo: Me! I'm so behind. What day works?
Mia: How about Monday night? We can go over lecture notes and practice problems.
Leo: Monday night it is! I'll bring snacks. We gotta ace this.",Mia and Leo are coordinating a study session for their biology exam on Monday night to review lecture notes and practice problems.
1e484b06,"Chloe: Hey, could you possibly do me a HUGE favor? I need to move some furniture this weekend.
Dan: Oof, moving furniture? What kinda favor is it?
Chloe: Just need an extra pair of hands to help me carry a couch upstairs. Saturday afternoon?
Dan: Yeah, I can probably swing that. Just text me when you're ready.",Chloe is asking Dan for a favor to help her move a couch upstairs on Saturday afternoon.
c7795b7e,"Ryan: Hey, can I borrow your new headphones? Mine are busted.
Chris: Oh man, yeah sure. Just be careful with them, they were pricey.
Ryan: Totally, I'll treat 'em like gold. When can I grab 'em?
Chris: I'm heading out now, but they're on my desk. Just swing by.","Ryan is asking to borrow Chris's new headphones because his are broken. Chris agreed, asking Ryan to be careful with them."
73c5587b,"Olivia: Hey, can you do me a solid? I need help moving a dresser on Sunday.
Sam: Oh man, Sunday? I was supposed to relax. What time?
Olivia: Like, midday? It won't take long, I promise!
Sam: Ugh, fine. But you owe me big time.","Olivia is asking Sam for help moving a dresser on Sunday midday. Sam reluctantly agreed, stating Olivia owes him."
032ec57d,"Noah: Hey, sorry to bother you, but I'm a bit short on cash this month. Any chance I could borrow like 50 bucks till payday?
Emily: Oh, um, yeah I guess. When's payday?
Noah: Next Friday. I'll pay you back first thing.
Emily: Okay, deal. Come grab it later.",Noah is asking Emily to borrow 50 dollars until his payday next Friday. Emily agreed.
eabefcb9,"Jake: Dude, my upstairs neighbor is playing techno at 3 AM. I can't sleep. What do I do?
Mark: Ugh, that's the worst. Have you tried talking to them?
Jake: Not yet, I don't wanna be confrontational. Idk.
Mark: Maybe leave a polite note first? Or bang on the ceiling lightly?","Jake is complaining about his noisy upstairs neighbor playing loud music late at night. Mark is suggesting ways to address the situation, like leaving a note or banging on the ceiling."
daef2962,"Mom: Hey everyone! Are we still on for the family reunion next month?
Dad: I think so, just need to confirm numbers.
Sis: I can bring my famous potato salad!
Bro: Cool, I'll handle the grill master duties.
Mom: Great! We need to figure out accommodation for Aunt Carol though.
Dad: I can ask Uncle Joe if she can crash with them.
Sis: Sounds good. I'll send out a group text tmrw for final headcount.
Bro: Perfect. Can't wait to see everyone!","Family members are coordinating logistics for a family reunion, discussing food, grilling, accommodation for Aunt Carol, and confirming headcount."
9bc16f1b,"Me: Ugh, I completely forgot to get milk yesterday.
Friend: Again? Lol. I'm heading to the store rn, need anything?
Me: Yes please! Can u grab milk, bread, and some eggs?
Friend: Sure thing. Anything else?
Me: Ooh, and maybe some of those cookies we like?
Friend: Haha, ok I'll try not to eat them all on the way home.","One friend is going grocery shopping and offers to pick up milk, bread, eggs, and cookies for another friend."
0f20092c,"Dev1: This bug is driving me crazy. It's like it only happens sometimes.
Dev2: I know! I've been staring at this code for hours.
Dev1: Did you try commenting out that last function? See if it still crashes?
Dev2: Yeah, it still does. I think it's something with the database connection.
Dev1: Hmm, maybe we need to update the drivers?
Dev2: Good idea. I'll try that rn and let you know.","Two developers are trying to debug a recurring bug in their code, suspecting it might be related to the database connection or drivers."
cc459a86,"Me: Hey, road trip this weekend?
Friend: Omg yes! Where to?
Me: Was thinking maybe the mountains? Hike and camp?
Friend: Sounds amazing! I'm in. Should we invite Sarah?
Me: Yeah, good idea! I'll text her. Should we leave Friday after work?
Friend: Perfect. I'll start packing my hiking boots!","Two friends are planning a spontaneous weekend road trip to the mountains for hiking and camping, and decide to invite another friend."
72116eb4,"Neighbor1: Excuse me, is this your dog barking non-stop? It's 2 AM.
Neighbor2: Oh, I'm so sorry! He gets anxious when there's thunder.
Neighbor1: Well, it's not thundering, and it's keeping the whole building awake.
Neighbor2: I'll try to get him to settle down. I'll bring him inside.
Neighbor1: Thank you. We have work early tomorrow.","A neighbor complains about a dog barking late at night, and the owner apologizes and promises to bring the dog inside."
118adc29,"Coder1: Still stuck on this loop issue.
Coder2: Ugh, I feel you. I think the variable scope is messed up.
Coder1: Maybe. I tried debugging it line by line but it's not showing anything obvious.
Coder2: Could it be a race condition? If two processes are trying to access it at once?
Coder1: That's possible. Let's try adding some locks and see what happens.
Coder2: Ok, I'll implement that. Fingers crossed!","Two coders are struggling to debug a loop issue, suspecting a variable scope problem or a race condition, and plan to add locks."
d3338cd9,"Me: Has anyone seen Max? He slipped out the door an hour ago and I can't find him anywhere!
Friend: Oh no! What does he look like?
Me: He's a golden retriever, super friendly, wearing a blue collar.
Friend: I'll keep an eye out while I'm walking my dog. Where did you last see him?
Me: Near the park on Elm Street. Please call if you see him!
Friend: Will do! Hope you find him soon.","Someone has lost their golden retriever, Max, and is asking neighbors to keep an eye out, describing him and his last known location."
0d6fa864,"Student1: Hey, are we still meeting to study for the chem exam?
Student2: Yeah! I was thinking tomorrow afternoon? Around 2?
Student1: Works for me. Where should we meet? The library?
Student2: Library sounds good. Or maybe my place? I have notes from last semester.
Student1: Your place is great! I'll bring snacks. We should invite Emily too.
Student2: Good idea! I'll text her now.","Students are coordinating a study group session for a chemistry exam, deciding on a time, location, and inviting another student."
5258ce7d,"Me: Okay, we need to plan Mark's surprise party!
Friend: Yes! His birthday is next Saturday.
Me: I was thinking a BBQ at my place?
Friend: Perfect! Who should we invite?
Me: Let's make a list. Definitely his family and our close friends.
Friend: Got it. I can handle decorations and the cake.
Me: Awesome! I'll send out secret invites tmrw. We need someone to distract him that day though.","Friends are planning a surprise BBQ party for Mark's birthday next Saturday, dividing tasks like invitations, decorations, and cake, and needing a plan to distract him."
5603cdec,"GymBro1: Dude, you hitting the gym today?
GymBro2: For sure! Trying to beat my deadlift PR.
GymBro1: Nice! I'm gonna focus on cardio today. Feeling sluggish.
GymBro2: Haha, I feel that. Need to get my protein shake after. You want one?
GymBro1: Nah, I'm good. Just gonna do my usual post-workout meal.
GymBro2: Alright man, catch you later then!","Two gym-goers are discussing their workout plans for the day, with one focusing on lifting and the other on cardio, and one offering a protein shake."
4cc73f92,"Me: Hey, can you watch my cat, Whiskers, this weekend? I'm going out of town.
Friend: Oh, sure! No problem. What does he eat?
Me: He loves the salmon pate. Just two small cans a day.
Friend: Got it. Any special instructions?
Me: Just make sure he has fresh water and try to play with him a bit. He gets lonely.
Friend: Will do! Don't worry about him.","Someone is asking a friend to pet sit their cat, Whiskers, for the weekend, and provides instructions on feeding and care."
e807febc,"Colleague1: Did you hear about John in accounting? Apparently he got passed over for that promotion again.
Colleague2: No way! That's so unfair, he works so hard.
Colleague1: I know, right? I heard they gave it to that new guy, Mike.
Colleague2: Ugh, figures. He barely knows what he's doing.
Colleague1: Seriously. It's all about who you know here, I guess.
Colleague2: Definitely. Makes you wonder why we even bother.","Two colleagues are gossiping about a coworker, John, who was passed over for a promotion that was given to a newer employee, Mike, expressing their dissatisfaction with the decision."
5a162079,"Me: I can't believe Alex and Jamie broke up.
Friend: I know! They seemed so perfect together.
Me: Right? What happened?
Friend: Apparently, Jamie found out Alex was still talking to his ex.
Me: Oh wow. That's rough. I guess it's understandable why Jamie is upset.
Friend: Totally. It's sad though, they were good together.","Friends are discussing the recent breakup of Alex and Jamie, with the reason being Alex's continued contact with his ex."
9893b1f9,"FitnessFan1: Ready for that spin class?
FitnessFan2: Totally! Need to burn off last night's pizza lol.
FitnessFan1: Haha, same! I'm trying a new yoga class later too.
FitnessFan2: Ooh, nice. I just wanna lift heavy today.
FitnessFan1: Whatever works! Just gotta keep moving, right?
FitnessFan2: Exactly! See ya on the bike!","Two fitness enthusiasts are discussing their workout plans, including a spin class, yoga, and weightlifting, emphasizing the importance of staying active."
e7b5954c,"Techie1: So, I'm torn between the new Pixel and the latest iPhone.
Techie2: Ooh, tough choice. What are you leaning towards?
Techie1: The Pixel's camera is insane, but I'm kinda used to the Apple ecosystem.
Techie2: Yeah, I get that. The iPhone's video recording is pretty solid too.
Techie1: And the battery life on the Pixel seems better from reviews.
Techie2: True. What's your budget looking like?
Techie1: Trying to stay under $800 if possible.","Two tech enthusiasts are comparing the latest Pixel and iPhone, discussing camera quality, ecosystem, video recording, and battery life, while considering their budget."
254a7901,"OfficeMate1: Did you see Carol's new haircut? It's... something.
OfficeMate2: OMG yes! I don't know what she was thinking. It looks like a helmet.
OfficeMate1: I was trying so hard not to stare during the meeting.
OfficeMate2: Same! And she was acting like it was fabulous.
OfficeMate1: Well, good for her for being confident I guess?
OfficeMate2: Yeah, confidence is key. Just wish she'd chosen a better style lol.","Two colleagues are gossiping about Carol's new haircut, finding it unflattering but acknowledging her confidence."
f7975b29,"Me: Damn, I forgot eggs again. And we're out of bread.
Friend: Lol, same old story. I can run to the store if you want.
Me: Would you? That'd be a lifesaver! Can you grab milk too?
Friend: Yep, no prob. Anything else?
Me: Hmm, maybe some chips for tonight? We're watching that new movie.
Friend: Done! Be back in like 30.","One friend offers to go grocery shopping for another, who forgot essential items like eggs and bread, and also needs milk and chips."
0dff42e5,"Me: Has anyone seen my keys? I swear I left them on the counter.
Friend: Nope, sorry! Did you check your bag?
Me: Yeah, like 5 times. This is so frustrating.
Friend: Hmm, maybe they fell behind the couch?
Me: Oh wait! I think I hear Mittens playing with something shiny under the sofa... oh no.
Friend: Lol, typical cat. Hope they're not broken!","Someone is looking for their lost keys, suspecting their cat might have hidden them, and finds them under the sofa."
69916545,"Fan1: OMG, that was an insane goal!
Fan2: I know, right?! I screamed so loud my neighbors probably hate me.
Fan1: We were so close to losing! I thought for sure they blew it.
Fan2: Me too! That last-minute save was clutch too.
Fan1: Best game I've watched all season.
Fan2: Definitely! Can't wait for the next one.","Fans are excitedly reacting to a sports match, particularly a last-minute goal and save, deeming it the best game of the season."
a1d1680b,"Me: Road trip next weekend?
Friend: YES! Where are we thinking?
Me: Maybe hit up that national park a few hours away? Camp overnight?
Friend: Omg, I'm so down! I need a break from the city.
Me: Cool. Should we invite Sam? He'd love it.
Friend: Good call. I'll text him. We leaving Friday evening?
Me: Sounds perfect. I'll start making a playlist.","Friends are planning a weekend road trip to a national park for camping, deciding to invite another friend and plan the departure time."
b7573566,"Alex: Hey, so about that junior dev position... i was thinking the salary range you offered was a bit low based on my experience.
Ben: hmm okay. what were you expecting?
Alex: I was hoping for something closer to 75k, considering my 3 years in full-stack.
Ben: 75k is pretty high for a junior role here. we usually cap at 65k.
Alex: i understand but i also bring a lot of skills in cloud deployment which i think adds value.
Ben: i can maybe bump it to 70k, that's the absolute max i can do.
Alex: ok, 70k plus a performance bonus maybe?
Ben: let me check on that. i'll get back to you by tmrw.","Alex is negotiating a salary for a junior dev position. He's asking for 75k, but Ben is offering 70k and will check about a performance bonus."
dbd15e64,"Chloe: Ugh, Liam, can u do me a huge favor?
Liam: depends what it is lol
Chloe: i totally forgot i promised my niece i'd take her to that new superhero movie this weekend.
Liam: oh nice. so what's the favor?
Chloe: would u mind picking up my dry cleaning on ur way home? its like right next to ur work.
Liam: yeah no prob, i can do that.
Chloe: omg thank u so much u're a lifesaver!! i'll owe u big time.
Liam: no worries, happy to help.",Chloe is asking Liam for a favor to pick up her dry cleaning on his way home because she forgot about taking her niece to a movie.
214a4ba7,"Sarah: OMG did u hear about Mark from accounting?
Jess: no what happened??
Sarah: apparently he's been secretly dating Brenda from HR. they were seen holding hands at lunch yesterday.
Jess: no WAY. i thought he was seeing that girl from marketing?
Sarah: me too! lol. Brenda's married though, isn't she?
Jess: yeah, she is. this is gonna blow up. ugh.
Sarah: total drama. keep this on the DL tho.","Sarah is gossiping with Jess about Mark from accounting secretly dating Brenda from HR, who is married. They agree to keep it a secret."
45b84ae3,"Mike: Hey, neighbor. So, uh, about the music.
Dave: Yeah? What about it?
Mike: It's just... it's pretty loud, pretty late. Especially on weeknights.
Dave: Oh, sorry man. We were just having a few friends over.
Mike: I get that, but my kids have school and I gotta get up early.
Dave: Right, right. I didn't realize. I'll keep it down.
Mike: Appreciate it. Thanks.","Mike is complaining to his neighbor Dave about the loud music late at night, especially on weeknights. Dave apologizes and agrees to keep it down."
567edcd3,"Emily: Has anyone seen my cat, Whiskers? I cant find him anywhere.
Tom: Oh no! When did you last see him?
Emily: This morning, before I left for work. He usually waits by the door when I get home.
Tom: Hmm, I haven't seen him. Did you check the shed?
Emily: Yeah, he's not there. He never goes far. He's a tabby with a white chest.
Tom: I'll keep an eye out while I walk my dog. Hope you find him soon!","Emily is looking for her lost cat, Whiskers, a tabby with a white chest. Tom hasn't seen him but will keep an eye out."
0ec90112,"Liam: Dude, my car is making this weird noise. Like a grinding sound when I brake.
Noah: Oh no. When did it start?
Liam: This morning. It's kinda scary. I don't think I can drive it much further.
Noah: Sounds like maybe your brake pads? Or rotors?
Liam: Idk man. Can you take a look? I'm totally broke rn.
Noah: Yeah, I can swing by after work. I've got some tools. Just don't drive it if you can help it.","Liam's car is making a grinding noise when he brakes, and he's worried it's serious. Noah will come over after work to take a look."
dc8eafc5,"Sam: Yo, you wanna hop on some Warzone later?
Chris: For sure! What time?
Sam: Maybe around 8? I gotta finish this report first.
Chris: Sounds good. You playing solo or squad up?
Sam: Squad up! Need to carry my noob friend lol.
Chris: Lmao, I feel that. I'll bring my A-game.",Sam and Chris are planning to play Warzone together around 8 PM after Sam finishes a report. They will squad up.
93865c90,"Maria: Hey, can I borrow like 50 bucks? Just until payday on Friday.
Jake: Ugh, tight rn but yeah, I can spot you. Need it for gas?
Maria: No, it's for groceries. Totally forgot to budget this week.
Jake: No worries. I'll Venmo you now. Just pay me back Friday, yeah?
Maria: Absolutely! Thanks so much, Jake. You're a lifesaver.",Maria is asking to borrow $50 from Jake until Friday for groceries. Jake agrees and will Venmo her the money.
24ad43a1,"Olivia: I'm so bored. Wanna do a spontaneous road trip this weekend?
Noah: Omg yes! Where to?
Olivia: Maybe head up to the mountains? Or check out that coastal town?
Noah: Mountains sound good! We could hike.
Olivia: Perfect! I'll pack snacks. You get the playlist ready.
Noah: Deal! Leaving Friday after work?",Olivia and Noah are planning a spontaneous road trip to the mountains for the weekend. They will leave on Friday after work.
6cddf26b,"Priya: This API integration is killing me. I keep getting a 404 error.
Ben: Hmm, 404 usually means not found. Did you check the endpoint URL?
Priya: Yeah, like a million times. And the headers seem fine too.
Ben: What about the request body? Maybe there's a typo in the JSON?
Priya: Ugh, let me re-check that... OMG you're right. I missed a comma. So stupid.
Ben: Lol happens to the best of us. Glad you found it!","Priya is having trouble with an API integration, getting a 404 error. Ben helps her realize she missed a comma in the JSON request body."
6a9b1007,"Anna: My internet is completely down. Nothing is loading.
Tech Support: Okay, can you please try restarting your modem and router?
Anna: I already did that twice. Still nothing.
Tech Support: And is the cable securely connected to the wall and the device?
Anna: Yes, everything looks fine. This is so frustrating, I work from home!
Tech Support: I understand. Let me check for any outages in your area. One moment please...",Anna is experiencing a complete internet outage and has already tried restarting her equipment. Tech support is checking for area outages.
36d7f4b4,"Mark: Thinking of a road trip next weekend. You in?
Sarah: Where are you thinking?
Mark: Maybe drive down to the coast? Check out that beach town.
Sarah: Ooh, I like that idea. How long would we go for?
Mark: Just Saturday and Sunday. Get back Sunday night.
Sarah: Sounds fun! I'm in. What should we do there?
Mark: Beach, good food, maybe some exploring.","Mark is planning a weekend road trip to a beach town for Saturday and Sunday. Sarah is interested and they plan to enjoy the beach, food, and exploring."
67ee52d8,"Jessica: I feel so awful today. Headache and sore throat.
Mike: Oh no, are you coming down with something?
Jessica: I think so. Just wanna curl up in bed all day.
Mike: You should probably take it easy then. Don't push yourself.
Jessica: Yeah, I might call in sick tomorrow.
Mike: Good idea. Let me know if you need anything.",Jessica feels sick with a headache and sore throat and is considering calling in sick tomorrow. Mike advises her to rest.
934ddc52,"Chris: Just finished my workout. Feeling pumped!
Dave: Nice! What did you do?
Chris: Hit the weights hard. Then some cardio.
Dave: I need to get back to the gym. Been slacking lately.
Chris: You should! It really helps with stress. Let's go together sometime?
Dave: Yeah, that'd be cool. Maybe next week?",Chris finished his workout and is feeling good. He invites Dave to go to the gym together next week.
53f52e1c,"Lisa: I'm starving. What should we get for dinner?
Kevin: Ugh, same. Pizza again?
Lisa: Nah, I'm not really feeling pizza tonight. How about Thai?
Kevin: Hmm, Thai sounds good. Or maybe Mexican?
Lisa: Mexican! Yes! Let's do tacos.
Kevin: Okay, tacos it is. You wanna order from that place on Elm Street?
Lisa: Perfect!","Lisa and Kevin are deciding on dinner. They decide against pizza and opt for Mexican food, specifically tacos from a place on Elm Street."
7254afc2,"Emma: Did you watch 'The Midnight Signal' last night?
Liam: OMG yes! Wasn't it insane?
Emma: Totally! I did NOT see that twist coming at the end.
Liam: Right?? I was on the edge of my seat. The acting was superb too.
Emma: For sure. I can't stop thinking about it.","Emma and Liam are discussing the TV show 'The Midnight Signal,' praising its plot twist and acting."
b2f397d2,"Chloe: Date night ideas? I'm drawing a blank.
Sam: How about that new Italian place downtown?
Chloe: Hmm, maybe. Or we could just do a movie night at home?
Sam: Movie night sounds chill. But maybe something a little more... active?
Chloe: Okay, how about bowling? Or mini golf?
Sam: Mini golf! Yes! Let's do that.",Chloe and Sam are brainstorming date night ideas. They decide on playing mini golf after considering a new restaurant and a movie night at home.
08afd86a,"Ben: Hey, did you catch the finale of 'City of Shadows'?
Sara: I did! Oh my god, what did you think?
Ben: It was wild! I can't believe they ended it like that.
Sara: I know! I was so shocked. Total cliffhanger.
Ben: Seriously. Now we have to wait a whole year. Ugh.","Ben and Sara are discussing the finale of the TV show 'City of Shadows,' expressing shock and frustration about the cliffhanger ending."
7c32f940,"Rachel: I'm so hungry rn. What do you feel like eating?
Tom: Idk, I'm pretty open. You want to get some sushi?
Rachel: Sushi sounds good, but maybe something a bit cheaper? We went out for sushi last week.
Tom: Fair enough. How about burgers then?
Rachel: Burgers! Yes! Let's do that. Can we get fries too?
Tom: Definitely. I know a great place.",Rachel and Tom are deciding on dinner. They decide on burgers from a specific place after considering sushi and wanting something cheaper.
c4b0f301,"Maya: Did you watch that documentary about deep sea creatures?
Leo: No, not yet! Was it good?
Maya: It was AMAZING. So creepy but so fascinating.
Leo: Oh cool. I love stuff like that. Is it on Netflix?
Maya: Yep! You should definitely check it out. The visuals were incredible.","Maya recommends a deep-sea creature documentary to Leo, describing it as creepy, fascinating, and visually incredible. It's available on Netflix."
5d1a95a4,"Liam: Ugh, I have so much homework rn. Calculus is killing me.
Chloe: Tell me about it. I'm drowning in history essays.
Liam: Did u start the chem lab report yet?
Chloe: Nope, saving the worst for last lol.
Liam: Same. I'm gonna pull an all-nighter prob.
Chloe: Don't do that! You'll regret it. Just do a bit now.
Liam: I wish I could. My brain is fried.
Chloe: Okay okay. Want to study together tmrw morning?
Liam: Maybe. Let me see how much I get done tonight.","Liam and Chloe are stressed about homework, particularly calculus and history essays. They plan to study together the next morning, though Liam is unsure if he'll have enough time to get things done the night before."
c2bf4868,"Maya: Hey! Do you have that amazing pasta recipe you made last week?
Sam: Which one? The creamy tomato one?
Maya: Yes! That one! It was so good.
Sam: Oh yeah, it was a hit.
Maya: I want to make it for dinner tonight. Can u send it?
Sam: Sure, hang on. Let me find it.
Sam: Okay, here it is. Just remember the secret ingredient is a pinch of nutmeg!
Maya: Omg thanks! You're the best!
Sam: No problem! Let me know how it turns out.","Maya asked Sam for a pasta recipe she made previously. Sam sent the recipe and Maya thanked her, promising to let her know how it turned out."
90583680,"Ben: So, the job interview is next week. Any tips?
Anna: Definitely research the company thoroughly. Know their mission and values.
Ben: Yeah, I've been doing that. What about the 'tell me about yourself' question?
Anna: Keep it concise and relevant to the job. Highlight your key skills and experiences.
Ben: Okay. And behavioral questions? Like 'a time you failed'?
Anna: Be honest but frame it positively. Focus on what you learned.
Ben: Got it. Thanks, Anna! You're a lifesaver.
Anna: Anytime! You'll do great.","Ben is preparing for a job interview and asking Anna for tips. Anna advises him to research the company, prepare for common interview questions, and focus on learning from past experiences."
88605343,"Leo: I'm starving. What should we get for dinner?
Mia: Ugh, I don't know. I'm so indecisive rn.
Leo: Pizza?
Mia: We had pizza yesterday.
Leo: Okay, fair. Tacos?
Mia: Maybe... what about Thai?
Leo: Ooh, I could go for some pad see ew.
Mia: Yes! Perfect. I'll order.
Leo: Awesome. Thanks!","Leo and Mia are deciding on dinner. They consider pizza and tacos but settle on Thai food, specifically pad see ew. Mia agrees to order."
