id,dialogue,summary
dede700e,"Sarah: hey u got those flight details for paris?
Mark: almost done
Mark: just confirming dates with jenna
Sarah: k lemme know asap
Sarah: prices are jumpin like crazy rn
Mark: ikr its wild
Mark: she said mid-july works for her
Mark: u cool with july 15-22?
Sarah: yeah thats fine by me
Sarah: business class or economy?
Mark: economy def
Mark: tryna save some cash lol
Sarah: fair enough
Sarah: book it then!
Mark: will do
Mark: ill send confirmation once its done",Sarah and Mark are booking flight tickets to Paris for July 15-22. They decided on economy class.
08678594,"Liam: OMG
Liam: fluffy is gone!!!!
Chloe: what?? no way
Chloe: did u check under the bed
Liam: everywhere chloe
Liam: i cant find him anywhere
Liam: his fav toy is still here
Chloe: oh no
Chloe: when did u last see him
Liam: like an hour ago
Liam: i went to the store for 10 mins
Chloe: okay dont panic
Chloe: ill come over rn and help u look
Liam: pls
Liam: im so scared","Liam's cat, Fluffy, is missing. Chloe is coming over to help him search."
271ba28f,"Jessica: i just dont get it
Jessica: he said he loved me like last week
Maria: ugh i know jess
Maria: its so messed up
Jessica: and now he just ghosted me? after two years?
Maria: yeah thats some real bs
Maria: have u tried calling him again
Jessica: whats the point
Jessica: he just sent a text saying 'its over'
Jessica: like wtf
Maria: im so sorry hun
Maria: u deserve better than that
Jessica: i feel so stupid
Maria: no! dont say that
Maria: hes the idiot, not you
Maria: lets get some wine tonight",Jessica is upset because her boyfriend broke up with her via text after two years. Maria is comforting her.
e99aecdf,"David: so they offered me the senior dev role
David: but the salary is a bit lower than i expected
Sarah: oh really
Sarah: how much lower
David: like 5k
Sarah: hmm that's kinda significant
Sarah: did u try to negotiate yet
David: not yet
David: i wanted to ask u first
David: what should i say
Sarah: just tell them u appreciate the offer but u were expecting closer to X based on ur experience
Sarah: and market rates for someone with ur skillset
David: okay okay
David: good idea
Sarah: worst they can say is no
Sarah: but they prob will meet u halfway
David: fingers crossed
David: thanks sarah",David received a job offer for a senior dev role but the salary is lower than expected. Sarah advises him on how to negotiate for a higher salary.
d5927e07,"Emily: yo which phone u thinkin of gettin
Ben: idk man
Ben: iphone 15 pro max or the new samsung s24 ultra
Emily: ooh tough choice
Emily: the iphone camera is like insane tho
Ben: fr but the samsung has that spen thingy
Ben: and its good for gaming
Emily: true true
Emily: battery life on the samsung is usually better too
Ben: yeah thats a big one for me
Ben: my current phone dies so fast rn
Emily: i heard the iphone screen is brighter outdoors tho
Ben: ugh why cant it be easy
Ben: i kinda like the dynamic island on iphone too
Emily: lmao good luck deciding
Ben: thanks i need it","Emily and Ben are discussing and comparing the features of the iPhone 15 Pro Max and the Samsung S24 Ultra, trying to decide which phone Ben should get."
16d8be4b,"Chris: u goin to the gym tmrw morning
Mike: nah cant make it
Mike: got an early meeting
Chris: aw man
Chris: was hopin to hit some chest and triceps
Mike: sorry dude
Mike: maybe after work?
Chris: nah im dead after work
Chris: wanna do saturday instead
Mike: yeah saturday morning works for me
Mike: 8am?
Chris: bet
Chris: dont skip leg day till then either lol
Mike: never!","Chris and Mike are planning to go to the gym together. They couldn't make it tomorrow morning, so they agreed to meet at 8 AM on Saturday."
571c2d37,"Anna: any luck finding whiskers
David: no nothing anna
David: ive put up flyers all over the neighborhood
Anna: oh no im so sorry
Anna: did u check the shelter again
David: yeah this morning
David: still no sign of him
Anna: what about social media
Anna: have u posted in the local groups
David: yep
David: everyone is lookin out but no sightings yet
Anna: dont give up hope
Anna: cats can wander far sometimes
David: i know
David: but its been three days now
David: starting to lose it","Anna and David are discussing Whiskers, David's lost cat. David has put up flyers and posted on social media but there's no sign of Whiskers yet."
e575ba7d,"Tom: ugh you WONT believe what my neighbors are doing now
Lisa: what fresh hell is it this time
Tom: they're having a full-blown concert in their backyard
Tom: its 11pm on a tuesday
Lisa: no way
Lisa: can u hear it from inside
Tom: like im at the show fr
Tom: my whole apartment is vibrating
Lisa: thats insane
Lisa: have u talked to them
Tom: i did last week about their dog barking all night
Tom: they just stared at me
Lisa: wow rude
Lisa: maybe call the landlord
Tom: im gonna
Tom: this is ridiculous",Tom is complaining to Lisa about his noisy neighbors who are having a loud party late on a Tuesday night. He plans to call the landlord.
d99e6682,"Chloe: hey sara u busy
Sara: not rlly whatsup
Chloe: super awkward question
Chloe: but would u be able to lend me some money
Sara: oh
Sara: how much we talkin
Chloe: like 200 bucks
Chloe: my car broke down and i need to pay the mechanic
Chloe: till i get paid next week
Sara: hmm
Sara: i can probably do 100 rn
Sara: is that enough to cover it
Chloe: no worries if not
Chloe: every bit helps
Chloe: i could maybe cover the rest till payday
Sara: okay ill send u 100 through venmo
Sara: u can pay me back whenever
Chloe: omg thank u so much sara
Chloe: u saved me",Chloe asked Sara to borrow 200 dollars to pay for car repairs. Sara was able to lend her 100 dollars.
9fd0888a,"Michael: has anyone seen a small brown poodle in the park area
Michael: he got off his leash
Maria: oh no michael
Maria: what's his name
Michael: charlie
Michael: he's really friendly but probably scared now
Liam: i just saw a dog like that near the school!
Liam: maybe 5 mins ago
Michael: really??
Michael: heading there now
Maria: ill drive by the park again too
Maria: maybe he doubled back
Michael: thanks guys
Michael: pls let me know if u see him","Michael's small brown poodle, Charlie, went missing near the park. Liam saw a dog matching the description near the school, and Maria is also helping to look for him."
3237bbff,"Kim: hey u going to the store later?
Leo: yea probably, why?
Kim: can u grab some stuff for me?
Leo: sure, what do u need
Kim: ok so like, milk, eggs, bread, n sum chips pls
Kim: oh and some avo!
Leo: ugh avo is so pricey rn
Kim: i know but i NEEED it
Leo: lol ok fine. anything else?
Kim: nope that's it! ill send u $$ later
Leo: sounds good see u","Kim asked Leo to pick up groceries for her: milk, eggs, bread, chips, and avocado. Leo agreed, despite avocado being expensive."
0ae2b6d0,"Chloe: heyyyy
Mark: wyd
Chloe: still stuck in traffic ugh
Mark: nooooo
Chloe: i know i'm gonna be so late for the meeting
Chloe: like prob 20-30 min
Mark: damn that sucks
Mark: should i tell jessica?
Chloe: pls do. tell her i'm so sorry and ill be there asap
Mark: k text her now
Chloe: thnx ur a lifesaver",Chloe is stuck in traffic and will be 20-30 minutes late for a meeting. She asked Mark to inform Jessica about her delay.
4f979aed,"Sam: yo this code is killin me
Alex: what's up
Sam: im getting a 'null pointer exception' but i swear everything is initialized
Alex: hmmm
Alex: check ur loops. sometimes an off-by-one error can cause that
Sam: i did! like 3 times
Alex: did u try printing out the var value right before the crash?
Sam: ...no
Alex: do that. it usually tells u where the actual problem is
Sam: k trying it rn
Sam: OMG U R A GENIUS
Sam: it was a tiny scope issue
Alex: lol glad to help","Sam was struggling with a 'null pointer exception' in his code. Alex suggested printing the variable value just before the crash, which helped Sam identify a scope issue, resolving the problem."
ce145526,"Jess: hey u free tmrw?
Liam: why? wanna hang?
Jess: nah can't
Jess: i feel like crap
Liam: aw man what's wrong
Jess: my throat is killin me and i have a fever
Jess: think i caught that flu going around
Liam: noooo that sucks
Liam: get some rest. drink lots of tea
Jess: trying to. thx","Jess is feeling sick with a sore throat and fever, likely the flu, and won't be able to hang out tomorrow. Liam advised her to rest and drink tea."
a1b0127c,"Sarah: hey did u ever book those flights for the trip?
Mike: not yet. still looking.
Sarah: find anything good?
Mike: prices r kinda high for july
Mike: found one for $450 round trip but it's a red-eye
Sarah: ugh i hate red-eyes
Mike: me too but it's the cheapest by like $100
Sarah: is there anything else around $500?
Mike: yeah but it has a layover in chicago for 4 hours
Sarah: that's still better than a red-eye idts
Mike: ok so u want the chicago one?
Sarah: yep! book that one pls
Mike: k will do","Sarah and Mike are discussing flight tickets for a trip. Mike found a $450 red-eye and a $500 flight with a 4-hour layover in Chicago. Sarah prefers the Chicago layover flight over the red-eye, and Mike will book it."
21522eb1,"Dave: u hear about what happened with accounting?
Maria: no! spill
Dave: apparently Brenda from accounts got fired
Maria: WHAT
Maria: no way
Dave: yeah that's what jake told me
Dave: something about ""mismanagement of funds""
Maria: omg no way
Maria: always thought she was a bit shifty tho
Dave: right? always had that expensive purse
Maria: lol true","Dave told Maria that Brenda from accounting was fired for ""mismanagement of funds."" They both expressed surprise but also implied they suspected something was off about her."
f07f90cd,"Emily: guess what!!
Ben: what???
Emily: i got the job offer!
Ben: CONGRATS!!!! that's awesome
Emily: ikr! but the salary is a bit lower than i hoped
Emily: they offered 65k
Ben: hmm that's ok but u can def push it
Ben: what's the range for that role usually?
Emily: i was hoping for like 70-75k
Ben: ok so ask for 73k. always aim a little higher than u want
Ben: they'll prob meet u in the middle
Emily: really? u think?
Ben: yeah trust me. worst they can say is no
Emily: ok im gonna try! thx ben","Emily received a job offer for $65k but hoped for $70-75k. Ben advised her to negotiate and ask for $73k, suggesting they might meet her in the middle. Emily decided to follow his advice."
78a1d59a,"Mark: ughhh
Sara: what's wrong?
Mark: my car just totally died on the highway
Sara: nooooo way
Mark: yeah. engine light came on then just stopped
Mark: im stuck on the side of the road
Sara: oh no! R u safe?
Mark: yeah i pulled over far enough
Mark: but i have no idea what to do
Sara: do u have roadside assistance?
Mark: i think so. i'll check my insurance app
Sara: ok call them first. if not i can come pick u up
Mark: thx sara ur the best",Mark's car broke down on the highway after the engine light came on. He's safely pulled over and is going to check his insurance for roadside assistance. Sara offered to pick him up if he can't get help.
e7bbeec3,"Liam: hey ready for the road trip this weekend??
Chloe: yessss so excited!
Chloe: did u make a playlist yet?
Liam: oh crap almost forgot! i'll do it tonight
Liam: what time r we leaving saturday?
Chloe: i was thinking early. like 6am? to beat traffic
Liam: ugh 6am is rough but ok
Liam: wanna stop at that diner for breakfast on the way?
Chloe: YES! the one with the pancakes right?
Liam: that's the one.
Chloe: perfect! don't forget snacks!
Liam: never!","Liam and Chloe are planning their weekend road trip. Chloe suggested leaving at 6 AM on Saturday to avoid traffic, and Liam agreed, also suggesting a stop at a diner for breakfast. Liam still needs to make a playlist, and Chloe reminded him about snacks."
e6b9685f,"Jenna: omg u wont BELIEVE IT
Dave: what happened
Jenna: mittens is gone
Jenna: i let her out this morning and she never came back
Dave: nooo not mittens!
Dave: did u check the back yard? under the deck?
Jenna: everywhere! i've been calling her name for like an hour
Jenna: i'm so worried
Dave: ok ok calm down.
Dave: did u post on the neighborhood fb group?
Jenna: not yet, i'm shaking too much
Dave: ok i'll do it for u. send me a pic of her
Jenna: ok thx dave. she has a pink collar","Jenna's cat, Mittens, is missing after being let out in the morning. She's very worried and has searched everywhere. Dave offered to post about the lost cat in the neighborhood Facebook group for her and asked for a picture, noting Mittens has a pink collar."
0cea93eb,"Sarah: Ugh, remember that smart speaker I bought last week?
Sarah: It's totally dead.
Mark: No way, already?
Sarah: Yeah, tried everything. Won't even turn on.
Mark: Did u try plugging it into a diff outlet?
Sarah: Lol obviously. And rebooting it like 5 times.
Mark: That sucks. U gonna take it back?
Sarah: Definitely. Gotta find the receipt tho. What a hassle.",Sarah's new smart speaker is faulty and won't turn on. She plans to return it but needs to find the receipt first.
7c0ea50a,"Leo: My internet's been acting up all morning.
Leo: It keeps disconnecting every few minutes.
Chloe: That's super annoying. Is it just ur laptop or like, everything?
Leo: Everything. Phone, tablet, my tv. Ugh.
Chloe: Did u restart the router?
Leo: Yeah, did that. Unplugged it for like a minute, plugged it back in.
Chloe: Still not working?
Leo: Nope. It'll work for a bit then just drop again.
Chloe: Maybe call ur ISP then? Sounds like a line issue or something.","Leo is experiencing constant internet disconnections on all his devices. He has tried restarting the router but the issue persists, so Chloe suggests calling his internet service provider."
6b495eb7,"Jenna: Heyyyy
Jenna: quick question
Jenna: Would u be free to pet sit for me next weekend?
Liam: Hey! Yeah, prob. What days?
Jenna: Fri night to Sunday afternoon.
Jenna: It's just Whiskers, my cat.
Liam: Aw Whiskers! Sure, I can do that. Is she pretty chill?
Jenna: Super chill. Just needs food/water top-ups and a litter box scoop once a day. And maybe some cuddles if she's feeling it lol.
Liam: No prob at all. Happy to help out!","Jenna asks Liam if he can pet sit her cat, Whiskers, for the upcoming weekend. Liam agrees to help out."
7c32a32e,"David: Hey dude
David: u busy tmrw evening?
Sam: Hey! Nah, not really. Why?
David: Could u do me a massive favor?
David: I gotta pick up this huge bookshelf from IKEA and my car's too small.
Sam: Oh no, the dreaded IKEA trip lol.
Sam: Yeah, I can help. My truck should be able to fit it.
David: Omg thank u so much!!!! Lifesaver.
Sam: No worries. What time u thinking?",David asks Sam for a favor to help him pick up a large bookshelf from IKEA because his car is too small. Sam agrees to help with his truck.
2ee28108,"Maya: Ugh this script is driving me insane
Maya: why isnt it returning anything?
Ben: Which one? The Python one for the data processing?
Maya: Yeah. Keeps giving me an empty array.
Ben: Lemme see. Did u check the file path? Classic mistake.
Maya: Already did. It's def correct.
Ben: What about the loop condition? Is it possible it's not entering the loop at all?
Maya: Hmmm.
Maya: Oh my god.
Maya: I used `<` instead of `<=`. I'm an idiot.
Ben: Lol been there. Good catch!","Maya is struggling to debug a Python script that keeps returning an empty array. Ben helps her troubleshoot, and she eventually finds a logical error in her loop condition."
7a50bdfb,"Chloe: My car just died.
Chloe: In the middle of nowhere almost.
Mark: Oh no! Where are u?
Chloe: On old mill road, just past the turn off for the diner.
Mark: Is it completely dead? No power at all?
Chloe: Engine light came on, then it just sputtered and stopped. Can't even get it to turn over.
Mark: That sounds like a battery or alternator issue. Do u have roadside assistance?
Chloe: Yeah I think so. Just called them but they said it could be an hour.
Mark: Want me to come wait with u?","Chloe's car has broken down on a rural road. Mark offers to come wait with her until roadside assistance arrives, suspecting a battery or alternator problem."
a90eccce,"Jess: So excited for our road trip this weekend!
Liam: Me too! Have u thought about snacks?
Jess: Obvs! Got a whole list. Chips, gummies, maybe some sandwiches for the drive.
Jess: And drinks! Gotta stay hydrated.
Liam: What kinda music we got for the playlist?
Jess: A good mix! Some throwbacks, some new stuff. What do u wanna hear?
Liam: Def some 90s pop! And maybe some chill indie vibes for the scenic parts.
Jess: Perfect! This is gonna be epic.","Jess and Liam are planning their weekend road trip, discussing snacks and the music playlist they'll listen to."
71d5aca4,"Emily: I need to return this shirt I bought online last week.
Emily: It arrived with a small rip near the collar.
Chris: Ugh, that's annoying. Is it super obvious?
Emily: Not really, but I know it's there, u know?
Chris: Totally. Did u start the return process online?
Emily: Not yet. I was gonna go to the store and see if they'd just exchange it.
Chris: That's probably easier. Just make sure u have ur order confirmation or the packing slip.
Emily: Yeah, I've got that ready. Hope they don't give me a hard time.",Emily needs to return a shirt she bought online because it arrived with a rip. She plans to go to the store to exchange it and hopes it will be a smooth process.
a01fc062,"Olivia: Hey, u still have that amazing pasta recipe from last year?
Chloe: Oh, the creamy tomato one with spinach?
Olivia: Yes! I keep thinking about it. Wanna make it this weekend.
Chloe: For sure! It's super easy. I can send u the ingredients list and steps.
Chloe: Do u have sun-dried tomatoes? That's key.
Olivia: I think so! What kind of cream do u use?
Chloe: Just heavy cream. And parmesan, loads of it lol.
Olivia: Sounds delish. Send it over pls!","Olivia asks Chloe for her creamy tomato pasta recipe with spinach. Chloe agrees to send it, mentioning key ingredients like sun-dried tomatoes, heavy cream, and parmesan."
9f155731,"Daniel: Dude, I'm so nervous for this interview on Monday.
Mark: You'll crush it! What kinda role is it again?
Daniel: Junior software dev. I just gotta practice my answers.
Mark: Wanna do a mock interview? I can ask u some common questions.
Daniel: Really? That'd be awesome! What should I prep for?
Mark: Tell me about yourself, strengths/weaknesses, why this company. The usual stuff.
Daniel: Okay, okay. Let's do it after dinner tonight?","Daniel is nervous about his junior software developer interview on Monday. Mark offers to do a mock interview with him tonight, suggesting common questions to prepare for."
a6e4bfb1,"Mark: ugh my car just died on the highway
Jess: no way! where r u?
Mark: just past the exit for the mall. its totally dead. not even starting
Tom: need a tow? i can call my guy
Mark: that would be amazing Tom. i'm kinda stuck here
Jess: ugh that sucks. hope its not too bad
Mark: me too. think its the battery or alternator maybe? idk
Tom: my guy will be there in like 30. hang tight
Mark: legend thanks man",Mark's car broke down on the highway. Tom called his tow truck guy to help Mark.
30ee54d9,"Aunt Carol: hey kids, for the family reunion in july, r we still doing the potluck?
David: yeah a.carol, i think so. everyone liked it last year
Sarah: defo! i can bring my famous potato salad again lol
Aunt Carol: ooo yes please sarah! and david, can u check on the park reservation?
David: oh crap i forgot about that! lemme call them tmrw morning
Aunt Carol: thanks sweety. and remember no gluten for uncle bob!
Sarah: lol will do. who's bringing dessert this time?
David: i'll coordinate desserts after i lock down the park",Aunt Carol is organizing the family reunion in July. They are planning a potluck. Sarah will bring her potato salad. David needs to confirm the park reservation and coordinate desserts.
50c0f8fe,"Liam: hey, did u look at flights for barcelona yet?
Chloe: omg no not yet! i got so busy rn
Liam: they're starting to go up. there was one rly good deal for may 15-22
Chloe: shoot really? let me check now
Chloe: ok i see it. <link_flight_deal> is this the one?
Liam: yeah! its direct and decent times
Chloe: ok im gonna book it now before it disappears. u good with those dates?
Liam: yep! go for it
Chloe: done! yay barcelona here we come!","Liam and Chloe are booking flights for Barcelona. Liam found a good deal for May 15-22, which Chloe is now booking."
2961929c,"Emily: hey ben, r u still thinking about that evening yoga class?
Ben: yeah totally! but my evenings are kinda packed this week
Emily: same. i saw they have a new 6am power flow on wednesdays tho
Ben: ugh 6am? that's so early
Emily: i know! but then its done. no interfering with dinner or anything
Ben: hmm. is it super hard? i'm still kinda new
Emily: nah it's challenging but good. we could try it once?
Ben: ok fine. if u promise to drag me outta bed lol
Emily: deal! see u there wednesday then!","Emily and Ben are trying to schedule a yoga class. Ben finds his evenings busy, so Emily suggests a 6 am power flow on Wednesdays. Despite Ben's reluctance due to the early time and difficulty, they agree to try it."
ebc52e00,"Mia: alex have u seen my keys? i cannot find them anywhere
Alex: your car keys or house keys?
Mia: both! my whole keychain. i swear i put them on the hook
Alex: hmm i haven't seen them since u came home last night. did u check your jacket pocket?
Mia: yeah! and my bag. i'm going crazy here. i need to leave in 10
Alex: oh wait! i think i saw them on the kitchen counter, kinda under that stack of mail
Mia: NO WAY! you're a lifesaver alex! found them! ugh i'm such a mess",Mia lost her keys and was frantically searching for them before needing to leave. Alex helped her find them on the kitchen counter under a stack of mail.
ddac2d23,"Chloe: hey sam, u still up for cat-sitting next month?
Sam: oh hey chloe! yeah totally! when r u away?
Chloe: from the 10th to the 17th. just a week
Sam: cool, no problem. is mittens still eating the fancy salmon stuff?
Chloe: lmao yeah, she's very particular. i'll leave a big bag out
Sam: got it. anything else i should know? like meds or anything?
Chloe: nope! just feed her twice a day and make sure she gets her cuddles. she's pretty chill
Sam: awesome. happy to help! have a great trip!
Chloe: thanks sam! u're the best!","Chloe asked Sam to cat-sit her cat, Mittens, from the 10th to the 17th of next month. Sam agreed and will feed Mittens twice a day and ensure she gets cuddles."
ce79f949,"Uncle John: so for the annual family picnic, who's in charge of the BBQ this year?
Lisa: i think cousin mike said he'd do it? but i haven't heard from him in ages
Mark: yeah, Mike's busy with work. maybe i can handle it? if someone helps me with the shopping
Uncle John: that would be great mark! lisa, can u coordinate the side dishes?
Lisa: sure! i'll set up a google doc for everyone to sign up for what they're bringing
Uncle John: perfect! and don't forget the kids activities. last year was a bit boring for the little ones
Mark: oh! i can bring my giant jenga set!
Lisa: good idea mark! i'll put it on the doc too.","Uncle John, Lisa, and Mark are planning the annual family picnic. Mark offered to handle the BBQ if Lisa helps with shopping. Lisa will coordinate side dishes using a Google Doc and also add Mark's giant Jenga set for kids' activities."
bfe73ae6,"Sarah: ugh i hate this stupid blender
Tom: what happened now? did it break again?
Sarah: yeah! it just made this grinding noise and then stopped. i only used it like 3 times!
Tom: that's ridiculous. u should return it. where did u buy it?
Sarah: amazon. but it's been more than 30 days since i bought it.
Tom: check their return policy. sometimes electronics have a longer warranty. or contact the manufacturer directly
Sarah: hmm good point. i still have the box and everything. worth a shot i guess.
Tom: totally. don't let them get away with selling u junk.","Sarah is frustrated because her blender broke after only three uses. Tom advised her to return it, suggesting she check Amazon's return policy or contact the manufacturer directly, even though it's been over 30 days."
8129137e,"Chloe: guys! weekend road trip idea?
Ben: oooo where to?
Mia: i'm in if it's not too far
Chloe: thought we could drive up to big bear, rent a cabin, do some hiking?
Ben: sounds amazing! when were u thinking?
Chloe: maybe next month? the first weekend?
Mia: yeah that works for me! we def need a cabin with a hot tub tho
Ben: agreed! and a good playlist for the drive
Chloe: lol of course. i'll start looking at cabins tonight.
Mia: sweet! lemme know what u find!","Chloe suggested a weekend road trip to Big Bear next month for hiking and renting a cabin. Ben and Mia are both in, agreeing on a cabin with a hot tub and a good playlist for the drive. Chloe will start looking for cabins."
29b54915,"Dad: kids, have u seen cooper anywhere? i cant find him
Emily: no dad, i haven't seen him since breakfast. is his dog door open?
Dad: yeah, but he's not in the yard either. i've called him a few times
Josh: oh no! maybe he chased a squirrel too far?
Emily: dad, let's go look for him. i'll check up the street, u check down
Dad: good idea em. josh, u stay here by the front door in case he comes back
Josh: ok! should i put out his favorite squeaky toy?
Dad: yes! anything to get his attention. hope he's ok.","Cooper, the family dog, is missing. Dad, Emily, and Josh are looking for him. Emily and Dad will search the neighborhood, while Josh stays by the front door and puts out Cooper's favorite toy."
