id,dialogue,summary
cb2f08f3,"Neighbor1: Excuse me, is this Mr. Henderson's apartment?
Resident: Yes, it is. Can I help you?
Neighbor1: Hi, I'm your neighbor from 3B. I wanted to talk about the noise.
Resident: Noise? What noise?
Neighbor1: Well, last night, your music was incredibly loud, way past midnight. It was impossible to sleep.
Resident: Oh, I had some friends over. I didn't realize it was that loud, sorry.
Neighbor1: It really was. We have to be considerate of each other, especially on a weeknight.
Resident: You're right. I apologize. It won't happen again.
Neighbor1: Thank you. I appreciate that.","A resident from apartment 3B complains to their neighbor, Mr. Henderson, about excessively loud music late at night. Mr. Henderson apologizes and assures it won't happen again."
3fa68a5b,"Traveler: Hi, I need to book a flight to Tokyo leaving next Friday, the 21st.
Agent: Okay, and where will you be flying from?
Traveler: From San Francisco. I'd like to return two weeks later, on the 5th of July.
Agent: Alright. Do you have a preferred airline or time of day?
Traveler: Not really, but I'd prefer a non-stop flight if possible, though I'm open to one stop if it's significantly cheaper.
Agent: Let me check... Okay, I see a non-stop flight with United for $1200. There's also a flight with a layover in Seoul on Korean Air for $950.
Traveler: Hmm, the $950 flight sounds good. Can you confirm the layover duration?
Agent: Yes, it's about a 3-hour layover. Would you like to book that one?
Traveler: Yes, please. That works for me.","A traveler books a round-trip flight from San Francisco to Tokyo, departing on the 21st and returning on July 5th. They opt for a $950 flight with Korean Air, including a 3-hour layover in Seoul."
1414a914,"Alex: Hey, uh, sorry to bother you again.
Neighbor: What is it now, Alex?
Alex: It's just... that smell coming from your bins is really quite bad. Especially when the wind blows this way.
Neighbor: Oh, is it? I haven't noticed.
Alex: Yeah, it's pretty strong. I was wondering if maybe you could get them emptied a bit more regularly?
Neighbor: They're collected on Tuesdays, same as everyone else's.
Alex: I know, but maybe there's something you could do in the meantime? Like put the rubbish in bags?
Neighbor: Look, I try to keep things clean. I'll see what I can do, alright?
Alex: Okay, thanks. Appreciate it.",Alex politely complains to his neighbor about a bad smell coming from their rubbish bins. The neighbor acknowledges the issue and says they will see what they can do.
69a3c3cb,"Chloe: omg did u see the new marketing intern? shes like super cute
Liam: lol yeah she is. pretty sure shes like 20 tho
Chloe: who cares lol. is she single?
Liam: idk man. probably. wyd tonight?
Chloe: idk. probs just chill. u?
Liam: was gonna ask her out but idk how to approach
Chloe: just walk up and say hi? lmao
Liam: easier said than done lmao. anyways, happy hour at the usual spot at 6?
Chloe: for sure. maybe we'll see her there lol","Chloe and Liam are gossiping about the new marketing intern, with Liam considering asking her out and Chloe suggesting they meet her at happy hour."
7668d528,"Maya: hey! so for date night tmrw, im thinking something chill
Sam: oh yeah? like what?
Maya: maybe that new italian place downtown? heard its good
Sam: ooh i like that idea. or we could do movie night at home? i got that new netflix thingy
Maya: hmm idk, im kinda feeling like going out tho
Sam: ok ok. italian it is! should i make a reservation?
Maya: yeah probs best. say like 7:30?
Sam: perfect. see u then!",Maya and Sam are planning a date night for tomorrow. They decide to go to a new Italian restaurant downtown at 7:30 PM.
863b3ae7,"Olivia: ugh im not feeling well today
Noah: oh no whats up?
Olivia: just feel super run down. headache, sore throat... the works
Noah: sounds like you might be coming down with something. take it easy today
Olivia: yeah im gonna try. cancelled my gym class this morning
Noah: good call. need to rest up. wanna order some soup later?
Olivia: that sounds amazing actually. thanks noah
Noah: anytime. let me know if u need anything else","Olivia is feeling sick with a headache and sore throat, so she's canceling her plans and Noah is offering to bring her soup."
56c58622,"Ben: hey man, so sorry but i gotta cancel tonight
Alex: noooo! why? i was looking forward to it
Ben: yeah i know, me too. but my sister just showed up outta nowhere and needs help with something
Alex: oh man, family emergency?
Ben: nah just needed help moving some furniture or something lol
Alex: ugh alright. raincheck?
Ben: def! maybe this weekend?
Alex: sounds good. text me when you're free",Ben has to cancel plans with Alex because his sister unexpectedly showed up and needs help moving furniture.
c8c4dd93,"Sarah: so i got the offer! but the salary is a bit lower than i expected
Mark: oh really? how much lower?
Sarah: like 5k lower. i was hoping for something closer to my last role
Mark: that sucks. did you try to negotiate?
Sarah: not yet. i wanted to talk to u first. what do u think i should say?
Mark: i'd say highlight your experience and the skills you bring. mention your previous salary too maybe?
Sarah: yeah good point. ill try that. wish me luck!
Mark: good luck! u got this.",Sarah received a job offer but the salary is lower than expected. She is asking Mark for advice on how to negotiate a higher salary.
e4a310dd,"Emily: hey, are we still on for movie night tmrw?
Jake: ahhh i dont think so, im so sorry
Emily: oh no! everything okay?
Jake: yeah yeah, just got swamped with work last minute stuff. need to catch up
Emily: oh bummer. i already bought snacks lol
Jake: lol i know, im really sorry. can we do it next week?
Emily: yeah, that works. just text me when you're free
Jake: will do!",Jake has to cancel movie night with Emily because he's swamped with last-minute work and needs to catch up.
e8ec32f9,"David: did you watch that new sci-fi show last night?
Laura: OMG yes! it was insane
David: right?? the plot twists were wild
Laura: i know! i did NOT see that ending coming at all
David: me neither. what do you think happens next season?
Laura: ooh good question. i have so many theories lol
David: me too. we should totally discuss it more sometime
Laura: definitely! maybe over coffee?","David and Laura are discussing a new sci-fi show they both watched, raving about the plot twists and speculating about the next season."
6bdc0359,"Sam: hey, got that interview tmrw morning
Jess: oh nice! what time?
Sam: 10am sharp. im kinda nervous lol
Jess: totally normal! what are they asking about?
Sam: standard stuff mostly, but they mentioned a tricky behavioral question
Jess: ah ok. well just be honest and give examples. remember that project you led?
Sam: oh yeah! good call. ill practice that one tonight
Jess: you'll do great! let me know how it goes",Sam is preparing for a job interview tomorrow at 10 AM and is nervous about a tricky behavioral question. Jess is offering advice and encouragement.
3b059183,"Mia: OMG i cant find my keys anywhere
Leo: seriously? where did you last have them?
Mia: i have no idea! i thought they were in my bag but they're not
Leo: did you check your pockets? your car?
Mia: yeah i checked everywhere! im freaking out
Leo: ok ok calm down. let me help you look. maybe they fell out somewhere
Mia: thanks leo, i appreciate it. this is so stressful
Leo: no worries. we'll find them",Mia has lost her keys and is frantically searching for them. Leo is trying to calm her down and help her look.
d3b99408,"Ben: ugh im so tired today
Anna: whats wrong?
Ben: just feel like im coming down with something. throat is scratchy and im achy
Anna: oh no! did you get any sleep?
Ben: not much. kept waking up
Anna: maybe you should call in sick today?
Ben: i thought about it. but i have that big presentation
Anna: hmm. maybe take some meds and see how you feel in a bit?
Ben: yeah, ill try that.","Ben is feeling unwell with a scratchy throat and body aches, but is hesitant to call in sick due to a presentation. Anna suggests he take some medication."
f6e28adf,"Tom: hey man, can you help me with this bookshelf?
Mike: sure, whats up?
Tom: its like impossible to put together. the instructions are confusing af
Mike: haha yeah those things can be tricky. let me see
Tom: here ya go. im stuck on step 3
Mike: ah i see. yeah you need to attach this piece first. see?
Tom: ohhh okay! makes sense now. thanks a lot!
Mike: no problem. happy to help",Tom is struggling to assemble a bookshelf and asks Mike for help. Mike is able to figure out the confusing instructions and helps Tom.
d11a5c0e,"Jessica: trying to book flights for our trip next month
Kevin: oh yeah? where are we going again?
Jessica: to hawaii! remember?
Kevin: right right lol. any good deals?
Jessica: found one for like $500 roundtrip, but its a red-eye
Kevin: hmm idk about a red-eye. what about the other one?
Jessica: the other one is $650 but its a morning flight. better hours
Kevin: lets do the morning flight then. worth the extra cash
Jessica: ok booked!",Jessica is booking flights for a trip to Hawaii and discusses options with Kevin. They decide on a more expensive morning flight instead of a red-eye.
ac0d45c1,"Chris: this rain is relentless
Pat: i know right? its been like this for days
Chris: im so over it. i wanted to go for a run this morning but it was pouring
Pat: same! i was gonna go for a bike ride. completely ruined
Chris: and it makes everything so gloomy
Pat: tell me about it. i just wanna see some sun
Chris: hopefully it clears up soon
Pat: fingers crossed!","Chris and Pat are complaining about the persistent rain, which has ruined their outdoor plans and made the weather gloomy."
032aa5a8,"Sarah: panic mode! i cant find my wallet
Mike: oh no! where did you last see it?
Sarah: i think i had it at the coffee shop earlier?
Mike: did you check your bag thoroughly?
Sarah: yes! and my pockets, my car... everywhere!
Mike: ok, dont freak out. i'll retrace your steps with you. maybe it fell out somewhere
Sarah: thanks mike, i owe you one
Mike: no problem. lets go look",Sarah has lost her wallet and is panicking. Mike is trying to calm her down and plans to retrace her steps to help her find it.
c9cb46d6,"Emily: omg i think i left my phone at the restaurant last night
Jake: no way! which one?
Emily: the thai place on elm street
Jake: shoot. did you call them yet?
Emily: not yet, im too scared lol
Jake: well you gotta. maybe someone turned it in
Emily: ugh fine. can you come with me just in case?
Jake: yeah of course. lets go now",Emily thinks she left her phone at a Thai restaurant and is scared to call. Jake is offering to go with her to check.
24873f60,"Olivia: so they offered me the senior role but the salary is kinda low
Noah: really? how low?
Olivia: like 10k less than i was expecting. i was hoping for more
Noah: wow thats a big difference. have you countered yet?
Olivia: not yet. wanted to get your thoughts first
Noah: i'd definitely counter. you have the experience. tell them your salary expectations based on that
Olivia: okay, ill try that. thanks for the advice
Noah: no problem. let me know how it goes","Olivia received a job offer for a senior role, but the salary is lower than expected. Noah advises her to counter and highlight her experience."
b6f0b4e0,"Liam: hey, im looking for a birthday gift for my mom
Chloe: oh nice! whens her birthday?
Liam: next week actually. im running out of time lol
Chloe: uh oh. what does she like?
Liam: shes really into gardening lately. and reading
Chloe: maybe a nice gardening tool set? or a new book by her favorite author?
Liam: ooh good ideas! i think she'd like the gardening stuff more
Chloe: cool. let me know what you get!","Liam is looking for a birthday gift for his mom, whose birthday is next week. Chloe suggests gardening tools or a book, and Liam leans towards the gardening tools."
c03ebb28,"Mark: what should we do for date night this friday?
Sarah: hmm idk. im kinda tired from the week
Mark: same. maybe something chill? like order in and watch a movie?
Sarah: yeah that could be nice. or we could go to that new board game cafe?
Mark: oh yeah! i forgot about that place. that sounds fun too
Sarah: ok lets do the cafe then? try something new?
Mark: perfect. ill book a table for you?",Mark and Sarah are planning date night for Friday. They consider ordering in but decide to go to a new board game cafe instead.
9548e188,"Anna: guys, im so worried. i cant find buddy anywhere
Ben: your dog? when did you last see him?
Anna: like an hour ago. he must have slipped out the gate
Ben: oh no! have you checked the whole street?
Anna: yes! and called his name. nothing
Ben: ok ok dont panic. ill help you look. maybe he went towards the park?
Anna: i hope not. he gets scared easily
Ben: we'll find him. come on","Anna is worried because her dog, Buddy, has escaped from her yard. Ben is helping her search the neighborhood."
e86d9e99,"Chloe: did you play that new fantasy game that just came out?
Liam: omg yes! i've been obsessed
Chloe: me too! the graphics are insane
Liam: i know right? and the storyline is so good
Chloe: im stuck on this one boss though. so frustrating
Liam: which one? maybe i can give you some tips?
Chloe: the dragon one. its like impossible
Liam: oh yeah, that one's tough. try using fire resistance potions","Chloe and Liam are discussing a new fantasy video game they are both playing. Chloe is frustrated with a difficult boss, and Liam offers advice."
da44b4cb,"Chloe: hey wyd rn
Liam: idk kinda hungry lol
Chloe: me too. pizza?
Liam: nah had that last nite
Chloe: chinese?
Liam: sure, i'll order if u want
Chloe: k sounds good. spicy noodles pls
Liam: got it.","Chloe and Liam are deciding what to eat for dinner. They decide on Chinese food, and Chloe requests spicy noodles."
36d5622b,"Maya: omg did u see the new iphone launch?
Ben: yeah! looks sick. is it worth the upgrade tho?
Maya: idk the camera is supposed to be insane
Ben: my phone is still pretty good, maybe ill wait
Maya: true, these things are so expensive
Ben: for sure. maybe next year lol","Maya and Ben are discussing the new iPhone launch. Ben is hesitant about upgrading due to the cost, while Maya is impressed by the camera."
d0af66b1,"Sarah: hey, about the reunion next month. are we confirmed for the park pavilion?
Tom: yeah, i booked it last week. just need to get a headcount.
Sarah: okay, i'll send out the invite link again.
Tom: cool. and who's bringing the cake?
Sarah: oh right! i forgot. can u handle that?
Tom: sure, no prob. chocolate?
Sarah: perfect!",Sarah and Tom are confirming details for a family reunion. They have the park pavilion booked and are discussing who will bring the cake.
8e9a0bb8,"Alex: ugh i feel so gross rn
Jess: what's wrong?
Alex: headache and my throat is killing me
Jess: oh no. have u taken anything?
Alex: yeah some ibuprofen but it's not helping much
Jess: maybe u should see a doc tomorrow?
Alex: probably. just wanna sleep it off rn.",Alex is feeling sick with a headache and sore throat. Jess suggests seeing a doctor.
3c94efcb,"Sam: road trip this weekend?
Mike: where to?
Sam: maybe the coast? catch some waves
Mike: ooh, sounds good. how far is it?
Sam: like 4 hours? we could leave friday after work
Mike: i'm in! should i pack a board?
Sam: definitely!",Sam and Mike are planning a weekend road trip to the coast to surf. They plan to leave Friday after work.
f973115b,"Olivia: so about the new job offer... they offered 70k
Noah: hmm, is that what you were expecting?
Olivia: a little more, tbh. i was hoping for 75k
Noah: can you negotiate?
Olivia: i think so. i have data on similar roles...
Noah: def go for it. you're worth it!
Olivia: thanks! wish me luck lol",Olivia received a job offer of 70k but was hoping for 75k. She plans to negotiate with Noah's encouragement.
c20c47c1,"Mark: dude, your dog barked all night again.
Chris: oh sorry man, he was just restless.
Mark: restless? it sounded like he was fighting a bear.
Chris: haha, nah. i'll try to keep him quiet tonight.
Mark: i'd appreciate that. i have an early meeting tmrw.",Mark is complaining to Chris about his dog barking all night. Chris apologizes and promises to keep the dog quiet.
75066c66,"Emily: hey, just wanted to give you a heads up. the recycling bins are overflowing again.
Ben: ugh, seriously? i just put mine out yesterday.
Emily: i know, right? it's like they don't get picked up often enough.
Ben: maybe we should call the city?
Emily: good idea. i'll do it later today.","Emily is telling Ben that the recycling bins are overflowing. Ben agrees it's a recurring problem, and Emily plans to call the city."
3735d18a,"Jessica: i think i'm getting sick.
Ryan: oh no, what's up?
Jessica: sore throat and super tired.
Ryan: are you going to work today?
Jessica: trying to push thru but idk if i can.
Ryan: take it easy if u can. don't want you getting worse.",Jessica thinks she is getting sick with a sore throat and fatigue. Ryan advises her to take it easy.
333cbfab,"Sophia: my head is pounding.
Ethan: bad day?
Sophia: yeah, and i feel feverish.
Ethan: oh man. did u sleep okay?
Sophia: no, kept waking up. i think i need to call in sick tmrw.
Ethan: probably a good call. rest up!",Sophia is feeling unwell with a headache and fever. She plans to call in sick for work tomorrow.
c1ad8f1f,"David: hey, is the family dinner still on for Saturday?
Anna: yep! just confirming times. 6pm still good?
David: perfect. i can bring the salad.
Anna: great! mom's making her famous lasagna.
David: nice! can't wait.","David and Anna are confirming details for a family dinner on Saturday at 6 PM. David will bring salad, and Anna's mother is making lasagna."
558e0143,"Liam: so it's mark's bday next week, right?
Olivia: yeah! we should do something.
Liam: surprise party?
Olivia: omg yes! where tho?
Liam: maybe at that bar downtown?
Olivia: good idea! who should we invite?
Liam: everyone! i'll start a group chat.",Liam and Olivia are planning a surprise birthday party for Mark at a downtown bar. They will start a group chat to invite people.
3cf9e4f7,"Mia: has anyone seen my dog, max? he slipped out the gate like an hour ago.
Sam: oh no! what does he look like?
Mia: he's a golden retriever, kinda fluffy.
Sam: okay, i'll keep an eye out. i'm walking around the park now.
Mia: thank u! he's super friendly.","Mia's golden retriever, Max, has escaped from her yard. Sam will look for him while walking in the park."
0ab9edd7,"Jake: hey, you free to help me assemble some furniture?
Chris: when?
Jake: tmrw afternoon? i got a new bookshelf.
Chris: yeah, i think so. what time?
Jake: like 2pm?
Chris: sounds good. i'll bring my drill.",Jake needs help assembling a new bookshelf tomorrow afternoon at 2 PM. Chris has agreed to help and will bring his drill.
0b62caa1,"Priya: did u finish that show 'the crown'?
Ben: not yet! i'm on season 3. it's so good tho.
Priya: i know! i binged the whole thing last week lol
Ben: jealous! who's your fave character?
Priya: def the queen. she's iconic.
Ben: totally agree.","Priya and Ben are discussing the TV show 'The Crown'. Ben is on season 3 and finds it good, while Priya has already binged the whole series."
cb93c2c9,"Emma: ahhh i can't find my keys anywhere!
Daniel: did u check your bag?
Emma: yeah like 10 times. they're gone.
Daniel: hmm, what about your coat pocket?
Emma: oh wait... haha found them! thank u!",Emma couldn't find her keys but eventually found them in her coat pocket after Daniel asked.
274a6687,"Kevin: thinking about that beach trip again.
Laura: me too! when should we go?
Kevin: maybe next month? before it gets too cold.
Laura: good idea. should we rent a place or just do day trips?
Kevin: let's rent a place for a weekend!",Kevin and Laura are planning another beach trip for the next month. They decide to rent a place for a weekend.
684adfe8,"Chloe: hey, sarah's bday is coming up.
Mike: oh yeah! we gotta get her a gift.
Chloe: i was thinking maybe a surprise party?
Mike: that would be awesome! where should we have it?
Chloe: maybe my place? it's bigger.
Mike: ok cool. i'll handle the cake.",Chloe and Mike are planning a surprise birthday party for Sarah at Chloe's place. Mike will handle the cake.
5cbf995f,"Tom: you playing that new space game?
Jerry: nah, not yet. is it good?
Tom: it's amazing! the graphics are insane.
Jerry: cool, maybe i'll get it this weekend.
Tom: u should! we could play multiplayer.","Tom is recommending a new space game to Jerry, praising its graphics and suggesting they play multiplayer."
3dc661d2,"Anna: still thinking about that weekend getaway.
Mark: me too! where should we go?
Anna: maybe a cabin in the mountains?
Mark: ooh, sounds cozy. when are u free?
Anna: next weekend works for me!
Mark: perfect, i'll look for cabins.","Anna and Mark are planning a weekend getaway to a cabin in the mountains. Anna is free next weekend, and Mark will look for cabins."
c962ad68,"Sarah: omg did u see mark's email about the new project?
Mike: yeah wtf was that? lol
Sarah: he's acting like he's the ceo or something
Mike: totally. and that typo in the second sentence. embarrassing
Sarah: right?? i can't deal. he thinks he's so smart","Sarah and Mike are gossiping about their colleague Mark's unprofessional email about a new project, noting his arrogance and a typo."
5e9df2f9,"Jessica: hey, can i ask u a huge favor?
Emily: depends on the favor lol
Jessica: i need someone to cover my shift tmrw night, im totally swamped
Emily: ugh, tmrw? i already have plans :( 
Jessica: oh nooo. please?? it would save my life
Emily: fine, but ur buying me coffee all week",Jessica asks Emily to cover her shift tomorrow night because she is swamped. Emily agrees but asks for coffee in return.
4a35a07f,"David: hey man, u free?
Chris: kinda, wyd?
David: my car just died on the highway. can u pick me up?
Chris: wtf? where are u?
David: exit 15. towed to the side rn
Chris: ok ok, be there in like 20",David's car broke down on the highway and he is asking Chris to pick him up.
d410311c,"Anna: booking flights for mexico is so stressful
Ben: tell me about it. prices are insane
Anna: i found one for 300 but it has a 10 hour layover
Ben: lol no way. i saw one for 450 direct
Anna: ugh, decisions decisions. i hate flying anyway","Anna and Ben are discussing the difficulty and cost of booking flights to Mexico, debating between a cheap flight with a long layover and a more expensive direct flight."
81e016b9,"Maria: hey, can u do me a solid?
Leo: maybe, what is it?
Maria: i'm going out of town this weekend, can u watch my cat?
Leo: oh, fluffy? yeah i can do that
Maria: omg thank u! i'll leave food and her favorite toy
Leo: no prob, i love that cat",Maria asks Leo to watch her cat while she is out of town for the weekend. Leo agrees.
e4a97f19,"Sam: GOOOOOOOALLLLLLLLLLLLLL!!!
Tom: YESSSSSSSS!!! i knew they had it in them
Sam: that was clutch! almost choked in the last 5 mins tho
Tom: i was sweating so hard lol
Sam: best game all season fr","Sam and Tom are excitedly reacting to a goal scored in a sports match, celebrating their team's victory."
d4d63d79,"Chloe: dude, im so broke rn
Liam: same. end of the month blues lol
Chloe: could u spot me like 50 bucks till payday?
i swear i'll pay u back wednesday
Liam: sigh. fine. but u owe me big time
Chloe: ur the best!!!",Chloe asks Liam if he can lend her $50 until payday because she is broke. Liam agrees.
fefaa896,"Noah: did you finish stranger things yet?
Olivia: omgggg yes last night. i cant stop thinking about it
Noah: i know right?? that ending was wild
Olivia: i totally didn't see that coming. ruined my sleep lol
Noah: same. need season 5 like, yesterday","Noah and Olivia are discussing the latest season of Stranger Things, expressing their shock and excitement about the ending and their anticipation for the next season."
1570edcb,"Liam: this history paper is killing me
Sophia: ugh tell me about it. i have like 10 pages left
Liam: and the exam is on friday!! how are we supposed to read all this?
Sophia: idk man, im just gonna cram tmrw night
Liam: lol good luck. i might need to pull an all-nighter","Liam and Sophia are stressed about a history paper and an upcoming exam, discussing their struggles with the workload and planning to cram."
7f7517e9,"Mark: im so over this relationship
Jessica: what happened now?
Mark: she just doesn't get me, you know? we're always fighting
Jessica: yeah, i've seen that. it sounds rough
Mark: i think we're just done. im gonna break up with her tonight",Mark is frustrated with his relationship and plans to break up with his girlfriend tonight because they are always fighting and she 'doesn't get him'.
e3826af0,"Chloe: did you hear about the layoffs?
Ben: noooo, really? who got cut?
Chloe: apparently a bunch of people from the marketing team. Janice from accounting too.
Ben: wow. things are getting serious then
Chloe: i'm kinda worried about my dept tbh","Chloe and Ben are discussing recent layoffs at their company, expressing concern and speculating about who was affected and the implications for their own departments."
51884f7d,"Manager: so, about your salary expectations
Employee: yes, i was hoping for something around 70k
Manager: hmm, we were thinking more in the 60-65k range for this role
Employee: i understand, but considering my experience and the market rate, 70k is more appropriate
Manager: let me see what i can do. i'll get back to you","An employee and their manager are negotiating salary. The employee is asking for $70k, while the manager initially proposed $60-65k. The manager will consider the employee's request."
a0c826b1,"Alex: OMG im so sorry im gonna be late
Sam: how late?
Alex: like 15 mins maybe? traffic is a nightmare rn
Sam: ugh ok. i'll tell the client you're on your way
Alex: thanks, see u soon!","Alex is running about 15 minutes late for a meeting due to traffic and apologizes to Sam, who will inform the client."
